{
  "schema_version": "po_trace_event_v1",
  "event_id": "evt_po_self_reconstruction_planned_001",
  "request_id": "req_demo",
  "event_type": "PoSelfReconstructionPlanned",
  "payload": {
    "plan_id": "rp_reqdemo_psdreqde",
    "decision_id": "psd_req_demo_1",
    "source_decision_type": "reconstruct",
    "plan_type": "revise_steps",
    "plan_status": "planned",
    "content_rewrite_allowed": false,
    "target_step_ids": ["step_002"],
    "operation_count": 1,
    "trigger_type": "priority_threshold",
    "max_priority_score": 7.5,
    "viewer_feedback_count": 0,
    "max_viewer_pressure": 0.0
  },
  "created_at": "2026-07-02T02:18:26Z",
  "parent_event_id": "evt_po_self_decision_001",
  "trace_refs": ["evt_po_self_decision_001"]
}
