{
  "schema_version": "po_trace_event_v1",
  "event_id": "evt_po_trace_blocked_reactivation_planned_001",
  "request_id": "req_demo",
  "event_type": "PoTraceBlockedReactivationPlanned",
  "payload": {
    "reactivation_plan_id": "rtp_reqdemo_seed001",
    "seedling_id": "seed_reqdemo_blockedt",
    "blocked_trace_ids": ["btr_reqdemo_a1b2c3d4"],
    "trigger_source": "blocked_trace_pressure",
    "reactivation_pressure": 0.775,
    "reactivation_threshold": 0.5,
    "plan_status": "planned",
    "reactivation_execution_allowed": false,
    "content_rewrite_allowed": false,
    "state_mutation_allowed": false,
    "safety_bypass_allowed": false,
    "operation_count": 1
  },
  "created_at": "2026-07-03T00:00:00Z",
  "parent_event_id": "evt_po_trace_blocked_reactivation_evaluated_001",
  "trace_refs": ["evt_po_trace_blocked_reactivation_evaluated_001"]
}
