{
  "schema_version": "po_trace_event_v1",
  "event_id": "evt_po_self_reconstruction_applied_001",
  "request_id": "req_demo",
  "event_type": "PoSelfReconstructionApplied",
  "payload": {
    "plan_id": "rp_reqdemo_psdreqde",
    "decision_id": "psd_req_demo_1",
    "patch_count": 1,
    "target_step_ids": ["step_002"],
    "execution_mode": "patch_proposal_only",
    "original_content_preserved": true,
    "original_content_mutated": false,
    "content_rewrite_applied": false,
    "cycle_guard_passed": true,
    "self_cycle_index": 1,
    "max_self_cycles": 1,
    "trace_continuity_verified": true
  },
  "created_at": "2026-07-02T02:35:29Z",
  "parent_event_id": "evt_po_self_reconstruction_planned_001",
  "trace_refs": [
    "evt_semantic_profile_001",
    "evt_po_self_decision_001",
    "evt_po_self_reconstruction_planned_001"
  ]
}
