{
  "schema_version": "po_trace_event_v1",
  "event_id": "evt_po_self_decision_001",
  "request_id": "req_001",
  "event_type": "PoSelfDecisionMade",
  "parent_event_id": "evt_viewer_feedback_001",
  "correlation_id": "req_001",
  "trace_refs": ["evt_semantic_profile_001", "evt_viewer_feedback_001"],
  "payload": {
    "po_self_decision": {
      "schema_version": "po_self_decision_v1",
      "decision_id": "psd_001",
      "request_id": "req_001",
      "decision_type": "preserve",
      "target_step_ids": [],
      "trigger": {
        "trigger_type": "none",
        "reason": "No discontinuity, ethics_delta, or viewer_feedback pressure exceeded configured thresholds."
      },
      "priority_summary": {
        "max_priority_score": 6.5,
        "mean_priority_score": 5.1,
        "critical_count": 0
      },
      "action_plan": {
        "action": "no_change",
        "explanation": "All semantic_step priority scores remain within normal bounds; current output is preserved unchanged."
      },
      "max_self_cycles": 3,
      "self_cycle_index": 1,
      "created_at": "2026-07-01T09:05:05Z",
      "viewer_feedback_refs": ["vf_001"],
      "trace_refs": ["evt_semantic_profile_001", "evt_viewer_feedback_001"],
      "human_review_required": false
    }
  },
  "created_at": "2026-07-01T09:05:05Z"
}
